{
  "$schema": "https://json-schema.org/draft/2020-12/schema",
  "$id": "https://phurley.github.io/daily-brief/schemas/geeknews.schema.json",
  "title": "Daily Brief Geek News",
  "description": "Sourced science and technology stories. starshipEstimatedLaunch is a legacy compatibility field; current consumers use starship.json.",
  "type": "object",
  "additionalProperties": false,
  "required": [
    "schemaVersion",
    "generatedAt",
    "editionDate",
    "stories"
  ],
  "properties": {
    "schemaVersion": {
      "const": "1.0.0"
    },
    "generatedAt": {
      "type": "string",
      "format": "date-time"
    },
    "editionDate": {
      "type": "string",
      "format": "date"
    },
    "starshipEstimatedLaunch": {
      "$ref": "#/$defs/starshipEstimatedLaunch"
    },
    "editorial": {
      "type": "object",
      "additionalProperties": false,
      "required": [
        "version",
        "generatedAt",
        "days"
      ],
      "properties": {
        "version": {
          "const": 1
        },
        "generatedAt": {
          "type": "string",
          "format": "date-time"
        },
        "days": {
          "type": "array",
          "maxItems": 3,
          "items": {
            "type": "object",
            "additionalProperties": false,
            "required": [
              "date",
              "selectedIds"
            ],
            "properties": {
              "date": {
                "type": "string",
                "format": "date"
              },
              "selectedIds": {
                "type": "array",
                "uniqueItems": true,
                "maxItems": 5,
                "items": {
                  "type": "string"
                }
              }
            }
          }
        },
        "corrections": {
          "type": "array",
          "items": {
            "type": "object"
          }
        }
      }
    },
    "stories": {
      "type": "array",
      "minItems": 0,
      "items": {
        "$ref": "#/$defs/story"
      }
    },
    "scienceInterests": {
      "type": "array",
      "items": {
        "type": "string"
      }
    },
    "selection": {
      "type": "object",
      "additionalProperties": false,
      "required": [
        "date",
        "selectedIds",
        "reasons"
      ],
      "properties": {
        "date": {
          "type": "string",
          "format": "date"
        },
        "selectedIds": {
          "type": "array",
          "maxItems": 6,
          "uniqueItems": true,
          "items": {
            "type": "string"
          }
        },
        "reasons": {
          "type": "object",
          "additionalProperties": {
            "type": "object"
          }
        }
      }
    }
  },
  "$defs": {
    "starshipEstimatedLaunch": {
      "type": "object",
      "additionalProperties": false,
      "required": [
        "status",
        "estimateLabel",
        "estimatedLaunchAt",
        "confidence",
        "summary",
        "sources"
      ],
      "properties": {
        "status": {
          "enum": [
            "scheduled",
            "targeted",
            "delayed",
            "completed",
            "unknown"
          ]
        },
        "estimateLabel": {
          "type": "string",
          "minLength": 1
        },
        "estimatedLaunchAt": {
          "oneOf": [
            {
              "type": "string",
              "format": "date-time"
            },
            {
              "type": "null"
            }
          ]
        },
        "confidence": {
          "enum": [
            "low",
            "medium",
            "high",
            "official"
          ]
        },
        "summary": {
          "type": "string",
          "minLength": 1
        },
        "photo": {
          "$ref": "#/$defs/photo"
        },
        "sources": {
          "type": "array",
          "minItems": 1,
          "items": {
            "$ref": "#/$defs/source"
          }
        }
      }
    },
    "story": {
      "type": "object",
      "additionalProperties": false,
      "required": [
        "id",
        "title",
        "summary",
        "url",
        "source",
        "publishedAt",
        "topics"
      ],
      "properties": {
        "editorial": {
          "type": "object",
          "required": [
            "grounded",
            "state",
            "reviewedAt",
            "expiresAt",
            "inputFacts",
            "publicationEvidence",
            "reason",
            "relevance",
            "novelty",
            "storyKey"
          ],
          "properties": {
            "grounded": {
              "const": true
            },
            "state": {
              "const": "verified"
            },
            "reviewedAt": {
              "type": "string",
              "format": "date-time"
            },
            "expiresAt": {
              "type": "string",
              "format": "date-time"
            },
            "inputFacts": {
              "type": "object"
            },
            "publicationEvidence": {
              "type": "string",
              "minLength": 1
            },
            "reason": {
              "type": "string",
              "minLength": 1
            },
            "relevance": {
              "type": "integer",
              "minimum": 3,
              "maximum": 5
            },
            "novelty": {
              "type": "integer",
              "minimum": 3,
              "maximum": 5
            },
            "storyKey": {
              "type": "string",
              "pattern": "^[a-z0-9]+(?:-[a-z0-9]+)*$"
            }
          }
        },
        "id": {
          "type": "string",
          "pattern": "^[a-z0-9]+(?:-[a-z0-9]+)*$"
        },
        "title": {
          "type": "string",
          "minLength": 1
        },
        "summary": {
          "type": "string",
          "minLength": 1
        },
        "url": {
          "type": "string",
          "format": "uri"
        },
        "photo": {
          "$ref": "#/$defs/photo"
        },
        "caveat": {
          "type": "string",
          "minLength": 1
        },
        "source": {
          "type": "object",
          "additionalProperties": false,
          "required": [
            "name"
          ],
          "properties": {
            "name": {
              "type": "string",
              "minLength": 1
            }
          }
        },
        "publishedAt": {
          "type": "string",
          "format": "date-time"
        },
        "topics": {
          "type": "array",
          "minItems": 1,
          "uniqueItems": true,
          "items": {
            "type": "string",
            "minLength": 1
          }
        },
        "localConnection": {
          "type": "string",
          "minLength": 1
        },
        "firstSeenAt": {
          "type": "string",
          "format": "date-time"
        },
        "checkedAt": {
          "type": "string",
          "format": "date-time"
        },
        "verifiedAt": {
          "type": "string",
          "format": "date-time"
        },
        "sourceUpdatedAt": {
          "type": "string",
          "format": "date-time"
        },
        "finding": {
          "type": "string",
          "minLength": 1
        },
        "significance": {
          "type": "string",
          "minLength": 1
        },
        "storyClusterId": {
          "type": "string",
          "minLength": 1
        },
        "sourceGroup": {
          "type": "string",
          "minLength": 1
        },
        "primarySourceUrl": {
          "type": "string",
          "format": "uri"
        },
        "paperUrl": {
          "type": "string",
          "format": "uri"
        },
        "sourceQuality": {
          "type": "number",
          "minimum": 0,
          "maximum": 3
        },
        "evidenceType": {
          "enum": [
            "peer-reviewed-research",
            "preprint",
            "agency-announcement",
            "mission-milestone",
            "explanatory-background",
            "unknown"
          ]
        },
        "milestoneStatus": {
          "enum": [
            "planned",
            "completed",
            "delayed",
            "unknown"
          ]
        },
        "entities": {
          "type": "array",
          "uniqueItems": true,
          "items": {
            "type": "string",
            "minLength": 1
          }
        },
        "supersedes": {
          "type": "array",
          "uniqueItems": true,
          "items": {
            "type": "string",
            "minLength": 1
          }
        }
      }
    },
    "source": {
      "type": "object",
      "additionalProperties": false,
      "required": [
        "name",
        "url"
      ],
      "properties": {
        "name": {
          "type": "string",
          "minLength": 1
        },
        "url": {
          "type": "string",
          "format": "uri"
        }
      }
    },
    "photo": {
      "type": "object",
      "additionalProperties": false,
      "required": [
        "url",
        "alt"
      ],
      "properties": {
        "url": {
          "type": "string",
          "format": "uri"
        },
        "alt": {
          "type": "string",
          "minLength": 1
        },
        "credit": {
          "type": "string",
          "minLength": 1
        },
        "sourceUrl": {
          "type": "string",
          "format": "uri"
        }
      }
    }
  }
}
