{"schemaVersion":"1.0.0","generatedAt":"2026-10-22T10:02:27.044927Z","editionDate":"2026-10-22","starshipEstimatedLaunch":{"status":"targeted","estimateLabel":"No earlier than September 18, 2026","estimatedLaunchAt":null,"confidence":"medium","summary":"SpaceX’s launch page does not list an official Flight 14 date. As of September 14, Next Spaceflight lists the first orbital Starship attempt as no earlier than September 18, 2026; its listed time is an independent estimate, not an official SpaceX schedule.","sources":[{"name":"SpaceX launches","url":"https://www.spacex.com/launches"},{"name":"Next Spaceflight","url":"https://nextspaceflight.com/launches/details/8346/"}]},"stories":[],"scienceInterests":[],"selection":{"date":"2026-10-22","selectedIds":["science-e5124c0745a1a06e","science-3dc92304bbbb16d2","science-9216e6cae5d0a88a","science-053fd0b7f05650b5","science-4c75cccf20fa67b7","science-1a44212d3a049509"],"reasons":{"science-e5124c0745a1a06e":{"score":31,"source":"NASA","topic":"astronomy","publishedAt":"2026-10-19T04:05:00Z","interestMatch":false},"science-3dc92304bbbb16d2":{"score":27,"source":"U-M","topic":"social-science","publishedAt":"2026-10-15T19:50:38Z","interestMatch":false},"science-9216e6cae5d0a88a":{"score":20,"source":"ESA","topic":"astronomy","publishedAt":"2026-10-13T12:00:00Z","interestMatch":false},"science-053fd0b7f05650b5":{"score":20,"source":"NSF","topic":"technology","publishedAt":"2026-10-08T13:45:03Z","interestMatch":false},"science-4c75cccf20fa67b7":{"score":19,"source":"NASA","topic":"earth-science","publishedAt":"2026-10-19T04:01:00Z","interestMatch":false},"science-1a44212d3a049509":{"score":15,"source":"U-M","topic":"health","publishedAt":"2026-10-15T17:03:02Z","interestMatch":false}}},"editorial":{"version":1,"generatedAt":"2026-10-22T20:06:36.453535-04:00","days":[{"date":"2026-10-21","selectedIds":[]},{"date":"2026-10-22","selectedIds":[]},{"date":"2026-10-23","selectedIds":[]}],"corrections":[{"id":"science-e5124c0745a1a06e","inputFacts":{"id":"science-e5124c0745a1a06e","title":"APOD: 2026 October 19 – Treble Clef: Unusual X-ray Hot Radio Source","url":"https://science.nasa.gov/image-article/apod-2026-october-19-treble-clef-unusual-x-ray-hot-radio-source","publishedAt":"2026-10-19T04:05:00Z","summary":"The Treble Clef, an unusual radio structure extending over 2 million light-years, is hypothesized to have originated from charged particles expelled by a supermassive black hole. These particles, after their radio emission faded, may have been re-energized by a shock wave resulting from the collision of two galaxy clusters.","finding":"The Treble Clef, an unusual radio structure extending over 2 million light-years, is hypothesized to have originated from charged particles expelled by a supermassive black hole. These particles, after their radio emission faded, may have been re-energized by a shock wave resulting from the collision of two galaxy clusters.","sourceUpdatedAt":"2026-10-19T04:05:00Z"},"publishedAt":"2026-10-19T00:05:00-04:00","publicationEvidence":"2026-10-19T00:05:00-04:00","datePrecision":"time"},{"id":"science-4c75cccf20fa67b7","inputFacts":{"id":"science-4c75cccf20fa67b7","title":"Autumn Paints Poland’s Bieszczady Mountains","url":"https://science.nasa.gov/earth/earth-observatory/autumn-paints-polands-bieszczady-mountains","publishedAt":"2026-10-19T04:01:00Z","summary":"Satellite imagery from Landsat 9 captured the seasonal transformation of Poland's Bieszczady National Park on October 8, 2026, showing fall colors in the forested slopes and tan patches of high-mountain meadows (polonina).","finding":"Satellite imagery from Landsat 9 captured the seasonal transformation of Poland's Bieszczady National Park on October 8, 2026, showing fall colors in the forested slopes and tan patches of high-mountain meadows (polonina).","sourceUpdatedAt":"2026-10-19T04:01:00Z"},"publishedAt":"2026-10-19T00:01:00-04:00","publicationEvidence":"2026-10-19T00:01:00-04:00","datePrecision":"time"},{"id":"science-05ac95315a4bdee0","inputFacts":{"id":"science-05ac95315a4bdee0","title":"APOD: 2026 October 18 – Sonified: Eagle Nebula Pillars","url":"https://science.nasa.gov/image-article/apod-2026-october-18-sonified-eagle-nebula-pillars","publishedAt":"2026-10-18T04:05:00Z","summary":"The Eagle Nebula (M16) contains dark, towering structures of cold gas and dust, sculpted by ultraviolet light and powerful winds from massive stars, which are likely similar to the environment where our Sun formed.","finding":"The Eagle Nebula (M16) contains dark, towering structures of cold gas and dust, sculpted by ultraviolet light and powerful winds from massive stars, which are likely similar to the environment where our Sun formed.","sourceUpdatedAt":"2026-10-18T04:05:00Z"},"publishedAt":"2026-10-18T00:05:00-04:00","publicationEvidence":"2026-10-18T00:05:00-04:00","datePrecision":"time"},{"id":"science-178a4d548f348666","inputFacts":{"id":"science-178a4d548f348666","title":"APOD: 2026 October 17 – 3D 67P","url":"https://science.nasa.gov/image-article/apod-2026-october-17-3d-67p","publishedAt":"2026-10-17T04:05:00Z","summary":"The Rosetta spacecraft's OSIRIS camera captured images of Comet 67P/Churyumov-Gerasimenko on July 25, 2015, revealing its double-lobed nucleus with dimensions of approximately 4 kilometers and 2.5 kilometers in diameter, joined by a narrow neck. Numerous jets were observed emanating from the comet's active surface.","finding":"The Rosetta spacecraft's OSIRIS camera captured images of Comet 67P/Churyumov-Gerasimenko on July 25, 2015, revealing its double-lobed nucleus with dimensions of approximately 4 kilometers and 2.5 kilometers in diameter, joined by a narrow neck. Numerous jets were observed emanating from the comet's active surface.","sourceUpdatedAt":"2026-10-17T04:05:00Z"},"publishedAt":"2026-10-17T00:05:00-04:00","publicationEvidence":"2026-10-17T00:05:00-04:00","datePrecision":"time"},{"id":"science-6a63b3a96ec49dd0","inputFacts":{"id":"science-6a63b3a96ec49dd0","title":"APOD: 2026 October 16 – Chasing the International Space Station","url":"https://science.nasa.gov/image-article/apod-2026-october-16-chasing-the-international-space-station","publishedAt":"2026-10-16T04:05:00Z","summary":"A Falcon 9 rocket and Dragon spacecraft successfully launched from Cape Canaveral Space Force Station, heading for low Earth orbit to rendezvous with the International Space Station on NASA's 35th Commercial Resupply Services mission.","finding":"A Falcon 9 rocket and Dragon spacecraft successfully launched from Cape Canaveral Space Force Station, heading for low Earth orbit to rendezvous with the International Space Station on NASA's 35th Commercial Resupply Services mission.","sourceUpdatedAt":"2026-10-16T04:05:00Z"},"publishedAt":"2026-10-16T00:05:00-04:00","publicationEvidence":"2026-10-16T00:05:00-04:00","datePrecision":"time"},{"id":"science-3dc92304bbbb16d2","inputFacts":{"id":"science-3dc92304bbbb16d2","title":"The stakes appear high for college students who gamble","url":"https://news.umich.edu/the-stakes-appear-high-for-college-students-who-gamble","publishedAt":"2026-10-15T19:50:38Z","summary":"The normalization of sports betting, particularly among young men, is a concern for college students, as many believe their sports knowledge provides an advantage or can supplement income, despite competing against a sophisticated industry designed for profit when bettors lose.","finding":"The normalization of sports betting, particularly among young men, is a concern for college students, as many believe their sports knowledge provides an advantage or can supplement income, despite competing against a sophisticated industry designed for profit when bettors lose.","sourceUpdatedAt":"2026-10-15T19:50:46Z"},"publishedAt":"2026-10-15T15:50:38-04:00","publicationEvidence":"2026-10-15T15:50:38-04:00","datePrecision":"time"},{"id":"science-4b31a65269f1add9","inputFacts":{"id":"science-4b31a65269f1add9","title":"NASA Satellites Observe Historic 2026 El Niño","url":"https://science.nasa.gov/earth/nasa-satellites-observe-historic-2026-el-nino","publishedAt":"2026-10-15T17:59:22Z","summary":"NASA satellites have observed the unfolding of a historic El Niño event in 2026, characterized by warmer-than-normal water temperatures in the equatorial Pacific, rising sea surface heights, and changes in ocean color due to decreased phytoplankton abundance.","finding":"NASA satellites have observed the unfolding of a historic El Niño event in 2026, characterized by warmer-than-normal water temperatures in the equatorial Pacific, rising sea surface heights, and changes in ocean color due to decreased phytoplankton abundance.","sourceUpdatedAt":"2026-10-15T20:07:23Z"},"publishedAt":"2026-10-15T13:59:22-04:00","publicationEvidence":"2026-10-15T13:59:22-04:00","datePrecision":"time"},{"id":"science-1a44212d3a049509","inputFacts":{"id":"science-1a44212d3a049509","title":"Whatcha lookin’ at? Social anxiety heightens brain sensitivity to others’ gaze","url":"https://news.umich.edu/whatcha-lookin-at-social-anxiety-heightens-brain-sensitivity-to-others-gaze","publishedAt":"2026-10-15T17:03:02Z","summary":"Young adults with higher levels of social anxiety exhibit stronger brain responses when a word describing mental states conflicts with what a gaze pattern seems to convey. This heightened neural sensitivity, specifically the N400 response, suggests an increased alertness to social cues, but it does not improve their explicit judgments about the meaning of the gaze.","finding":"Young adults with higher levels of social anxiety exhibit stronger brain responses when a word describing mental states conflicts with what a gaze pattern seems to convey. This heightened neural sensitivity, specifically the N400 response, suggests an increased alertness to social cues, but it does not improve their explicit judgments about the meaning of the gaze.","sourceUpdatedAt":"2026-10-15T17:03:13Z"},"publishedAt":"2026-10-15T13